{
  "schema_version": "vista.playable-action-catalog/v5",
  "catalog_id": "vista_indoor_actions",
  "catalog_revision": "vista_indoor_actions_r5",
  "source_catalog_binding": {
    "schema_version": "vista.playable-action-catalog/v4",
    "catalog_id": "vista_indoor_actions",
    "catalog_revision": "vista_indoor_actions_r4",
    "content_digest": "0865991e4ee97da51c62a593f3cce34275316b3b025c994cb66fbb245b342107"
  },
  "candidate_animation_sources": [
    {
      "source_id": "makehuman_cc0_r8",
      "profile_schema_version": "vista.makehuman-cc0-animation-profile/v1",
      "profile_id": "makehuman_cc0_animation_vertical_slice_r1",
      "content_digest": "3a596cb3088f1e2439b70c5c3c099e6ecbc521c7658af7eb52804fe5811654f2",
      "acceptance_state": "candidate_unaccepted",
      "action_ids": [
        "idle",
        "walk",
        "jog",
        "sprint",
        "pick_up",
        "place"
      ]
    },
    {
      "source_id": "makehuman_cc0_r14",
      "profile_schema_version": "vista.makehuman-cc0-detail-actions-profile/v1",
      "profile_id": "makehuman_cc0_detail_actions_r14",
      "content_digest": "eccf9da1ca7283efc08cffabe1d52ba020578e3d7c04d423cb2356f25b320d43",
      "acceptance_state": "candidate_unaccepted",
      "action_ids": [
        "inspect",
        "articulation.open",
        "close"
      ]
    },
    {
      "source_id": "makehuman_cc0_r15",
      "profile_schema_version": "vista.makehuman-cc0-detail-actions-r15-profile/v1",
      "profile_id": "makehuman_cc0_detail_actions_r15",
      "content_digest": "fb88d2cdfe810226d84b9111cbe99ad7c13842cab0e60c4af48354fe5bc02384",
      "acceptance_state": "candidate_unaccepted",
      "action_ids": [
        "turn_on",
        "turn_off",
        "press_button",
        "articulation.open",
        "close",
        "sit_down",
        "seated_idle",
        "stand_up",
        "pour"
      ]
    }
  ],
  "actions": [
    {
      "action_id": "idle",
      "source_action_id": "idle",
      "native_definition": null,
      "readiness": {
        "animation": {
          "evidence_digest": null,
          "status": "candidate"
        },
        "backend": {
          "evidence_digest": null,
          "status": "candidate"
        },
        "event_mapping": {
          "evidence_digest": null,
          "status": "blocked"
        },
        "object_state": {
          "evidence_digest": null,
          "status": "not_applicable"
        },
        "runtime_acceptance": {
          "evidence_digest": null,
          "status": "blocked"
        }
      }
    },
    {
      "action_id": "walk",
      "source_action_id": "walk",
      "native_definition": null,
      "readiness": {
        "animation": {
          "evidence_digest": null,
          "status": "candidate"
        },
        "backend": {
          "evidence_digest": null,
          "status": "candidate"
        },
        "event_mapping": {
          "evidence_digest": null,
          "status": "candidate"
        },
        "object_state": {
          "evidence_digest": null,
          "status": "not_applicable"
        },
        "runtime_acceptance": {
          "evidence_digest": null,
          "status": "blocked"
        }
      }
    },
    {
      "action_id": "jog",
      "source_action_id": "jog",
      "native_definition": null,
      "readiness": {
        "animation": {
          "evidence_digest": null,
          "status": "candidate"
        },
        "backend": {
          "evidence_digest": null,
          "status": "candidate"
        },
        "event_mapping": {
          "evidence_digest": null,
          "status": "blocked"
        },
        "object_state": {
          "evidence_digest": null,
          "status": "not_applicable"
        },
        "runtime_acceptance": {
          "evidence_digest": null,
          "status": "blocked"
        }
      }
    },
    {
      "action_id": "sprint",
      "source_action_id": "sprint",
      "native_definition": null,
      "readiness": {
        "animation": {
          "evidence_digest": null,
          "status": "candidate"
        },
        "backend": {
          "evidence_digest": null,
          "status": "candidate"
        },
        "event_mapping": {
          "evidence_digest": null,
          "status": "blocked"
        },
        "object_state": {
          "evidence_digest": null,
          "status": "not_applicable"
        },
        "runtime_acceptance": {
          "evidence_digest": null,
          "status": "blocked"
        }
      }
    },
    {
      "action_id": "turn_in_place",
      "source_action_id": "turn_in_place",
      "native_definition": null,
      "readiness": {
        "animation": {
          "evidence_digest": null,
          "status": "blocked"
        },
        "backend": {
          "evidence_digest": null,
          "status": "candidate"
        },
        "event_mapping": {
          "evidence_digest": null,
          "status": "blocked"
        },
        "object_state": {
          "evidence_digest": null,
          "status": "not_applicable"
        },
        "runtime_acceptance": {
          "evidence_digest": null,
          "status": "blocked"
        }
      }
    },
    {
      "action_id": "crouch",
      "source_action_id": "crouch",
      "native_definition": null,
      "readiness": {
        "animation": {
          "evidence_digest": null,
          "status": "blocked"
        },
        "backend": {
          "evidence_digest": null,
          "status": "candidate"
        },
        "event_mapping": {
          "evidence_digest": null,
          "status": "blocked"
        },
        "object_state": {
          "evidence_digest": null,
          "status": "not_applicable"
        },
        "runtime_acceptance": {
          "evidence_digest": null,
          "status": "blocked"
        }
      }
    },
    {
      "action_id": "look_at",
      "source_action_id": "look_at",
      "native_definition": null,
      "readiness": {
        "animation": {
          "evidence_digest": null,
          "status": "blocked"
        },
        "backend": {
          "evidence_digest": null,
          "status": "candidate"
        },
        "event_mapping": {
          "evidence_digest": null,
          "status": "candidate"
        },
        "object_state": {
          "evidence_digest": null,
          "status": "not_applicable"
        },
        "runtime_acceptance": {
          "evidence_digest": null,
          "status": "blocked"
        }
      }
    },
    {
      "action_id": "inspect",
      "source_action_id": "inspect",
      "native_definition": null,
      "readiness": {
        "animation": {
          "evidence_digest": null,
          "status": "candidate"
        },
        "backend": {
          "evidence_digest": null,
          "status": "candidate"
        },
        "event_mapping": {
          "evidence_digest": null,
          "status": "candidate"
        },
        "object_state": {
          "evidence_digest": null,
          "status": "not_applicable"
        },
        "runtime_acceptance": {
          "evidence_digest": null,
          "status": "blocked"
        }
      }
    },
    {
      "action_id": "pause",
      "source_action_id": "pause",
      "native_definition": null,
      "readiness": {
        "animation": {
          "evidence_digest": null,
          "status": "blocked"
        },
        "backend": {
          "evidence_digest": null,
          "status": "candidate"
        },
        "event_mapping": {
          "evidence_digest": null,
          "status": "candidate"
        },
        "object_state": {
          "evidence_digest": null,
          "status": "not_applicable"
        },
        "runtime_acceptance": {
          "evidence_digest": null,
          "status": "blocked"
        }
      }
    },
    {
      "action_id": "pick_up",
      "source_action_id": "pick_up",
      "native_definition": null,
      "readiness": {
        "animation": {
          "evidence_digest": null,
          "status": "candidate"
        },
        "backend": {
          "evidence_digest": null,
          "status": "candidate"
        },
        "event_mapping": {
          "evidence_digest": null,
          "status": "candidate"
        },
        "object_state": {
          "evidence_digest": null,
          "status": "candidate"
        },
        "runtime_acceptance": {
          "evidence_digest": null,
          "status": "blocked"
        }
      }
    },
    {
      "action_id": "carry",
      "source_action_id": "carry",
      "native_definition": null,
      "readiness": {
        "animation": {
          "evidence_digest": null,
          "status": "blocked"
        },
        "backend": {
          "evidence_digest": null,
          "status": "blocked"
        },
        "event_mapping": {
          "evidence_digest": null,
          "status": "blocked"
        },
        "object_state": {
          "evidence_digest": null,
          "status": "not_applicable"
        },
        "runtime_acceptance": {
          "evidence_digest": null,
          "status": "blocked"
        }
      }
    },
    {
      "action_id": "place",
      "source_action_id": "place",
      "native_definition": null,
      "readiness": {
        "animation": {
          "evidence_digest": null,
          "status": "candidate"
        },
        "backend": {
          "evidence_digest": null,
          "status": "candidate"
        },
        "event_mapping": {
          "evidence_digest": null,
          "status": "candidate"
        },
        "object_state": {
          "evidence_digest": null,
          "status": "candidate"
        },
        "runtime_acceptance": {
          "evidence_digest": null,
          "status": "blocked"
        }
      }
    },
    {
      "action_id": "drop",
      "source_action_id": "drop",
      "native_definition": null,
      "readiness": {
        "animation": {
          "evidence_digest": null,